{
  "schema_version": "1.0",
  "action_id": "kick",
  "name": "右脚踢球",
  "description": "预标定踢球动作",
  "frames": [
    {"index": 0, "duration_s": 0.12, "joints": {"right_hip_pitch": 18.0, "right_knee_pitch": 8.0, "right_ankle_pitch": 5.0}},
    {"index": 1, "duration_s": 0.12, "joints": {"right_hip_pitch": 26.0, "right_knee_pitch": 18.0, "right_ankle_pitch": 10.0}},
    {"index": 2, "duration_s": 0.12, "joints": {"right_hip_pitch": -10.0, "right_knee_pitch": 5.0, "right_ankle_pitch": -2.0}}
  ],
  "meta": {"source": "webots-calibration"}
}
